[
  {
    "state": "WA",
    "election_date": "2026-11-03",
    "election_type": "General",
    "jurisdiction": "state",
    "ocd_division_id": "ocd-division/country:us/state:wa",
    "name": "GENERAL 2026",
    "election_id": "899",
    "source_url": "https://voter.votewa.gov/CandidateList.aspx?e=899"
  }
]
