[
  {
    "state": "TX",
    "election_date": "2025-11-04",
    "election_type": "Special",
    "jurisdiction": "state",
    "ocd_division_id": "ocd-division/country:us/state:tx",
    "name": "2025 SPECIAL ELECTION CONGRESSIONAL DISTRICT 18",
    "election_id": "51742",
    "source_url": ""
  },
  {
    "state": "TX",
    "election_date": "2025-11-04",
    "election_type": "Special",
    "jurisdiction": "state",
    "ocd_division_id": "ocd-division/country:us/state:tx",
    "name": "2025 SPECIAL ELECTION SENATE DISTRICT 9",
    "election_id": "51830",
    "source_url": ""
  }
]
